{
  "$schema": "../../../docs/evaluation_workbook/schemas/selection.schema.json",
  "continuations": [
    {
      "checkpoint_absolute_path": "/home/sdc_joran/Journal/deeprl_signal_control/runs/revised/grid/ia2c/seed_101/baseline/publication_20260919T110516_bffa1fe4/checkpoint_001320000",
      "checkpoint_file_count": 6,
      "checkpoint_hash": "05d01f5d3b1a67ee81cfc515568fced393b8be0f3757003bec352c88f029dce5",
      "checkpoint_path": "runs/revised/grid/ia2c/seed_101/baseline/publication_20260919T110516_bffa1fe4/checkpoint_001320000",
      "controller": "ia2c",
      "experiment_env_source_hash": "f949d8c233bad1247f6f9b0ca786b335d2a84c6124963d3797586125a50b207b",
      "id": "continuation-grid-ia2c-baseline",
      "kind": "continuation",
      "learning_steps": 2320000,
      "manifest_file_sha256": "bcabf83a5687eb1b20eb2cbcaa1863b3b76ea1e4b3da5192a20bc6825fdd58bb",
      "manifest_hash": "66e6824e98a6b79ccf0d9b03743ab328ff9b504787f3595269c1d1c8b5a561e2",
      "manifest_path": "runs/revised/grid/ia2c/seed_101/baseline/publication_20260919T110516_bffa1fe4/manifest.json",
      "method": "baseline",
      "network": "grid",
      "result_path": "runs/revised/grid/ia2c/seed_101/baseline/publication_20260919T110516_bffa1fe4/result.json",
      "runtime": {
        "blas_threads": "1",
        "concurrent_workers": "unspecified",
        "logical_cpus": 20,
        "numpy": "1.26.4",
        "omp_threads": "1",
        "platform": "Linux-6.8.0-124-generic-x86_64-with-glibc2.35",
        "python": "3.10.12",
        "tensorflow": "2.15.1",
        "tensorflow_threads": 1
      },
      "runtime_compatibility": "known_baseline_runtime_mismatch",
      "source_commit": "8fd0e625b0535502fada77020e6db418939e2225",
      "stage_simulation_steps": 1320000,
      "status": "complete",
      "training_seed": 101
    },
    {
      "checkpoint_absolute_path": "/home/sdc_joran/Journal/deeprl_signal_control/output_coevolution/revised/grid/ia2c/seed_101/random_group/publication_20260922T114628_37d306e3/checkpoint_001320000",
      "checkpoint_file_count": 6,
      "checkpoint_hash": "9c62ec903f7e051b1e2ab8e490d8f21c5399c2911a73139c7743ad4c512c6b10",
      "checkpoint_path": "output_coevolution/revised/grid/ia2c/seed_101/random_group/publication_20260922T114628_37d306e3/checkpoint_001320000",
      "controller": "ia2c",
      "experiment_env_source_hash": "72773473a88abae5bf6fe048b953886fcde1c92481bc2010d368b3bd0b0a6517",
      "id": "continuation-grid-ia2c-random_group",
      "kind": "continuation",
      "learning_steps": 2320000,
      "manifest_file_sha256": "6ae05b08fefe0707dc85a535b773e9a08d116272ab15fccd86849fcadf493810",
      "manifest_hash": "7b31a4e4338426e082d71e9a80d073dab3713bbdcbd7fd2af6204da022a9892f",
      "manifest_path": "output_coevolution/revised/grid/ia2c/seed_101/random_group/publication_20260922T114628_37d306e3/manifest.json",
      "method": "random_group",
      "network": "grid",
      "result_path": "output_coevolution/revised/grid/ia2c/seed_101/random_group/publication_20260922T114628_37d306e3/result.json",
      "runtime": {
        "blas_threads": "1",
        "concurrent_workers": "unspecified",
        "logical_cpus": 20,
        "numpy": "1.19.5",
        "omp_threads": "1",
        "platform": "Linux-6.8.0-124-generic-x86_64-with-debian-bookworm-sid",
        "python": "3.6.13",
        "tensorflow": "1.12.0",
        "tensorflow_threads": 1
      },
      "runtime_compatibility": "reference_runtime_group",
      "source_commit": "8fd0e625b0535502fada77020e6db418939e2225",
      "stage_simulation_steps": 1320000,
      "status": "complete",
      "training_seed": 101
    },
    {
      "checkpoint_absolute_path": "/home/sdc_joran/Journal/deeprl_signal_control/output_coevolution/revised/grid/ia2c/seed_101/domain_randomization/publication_20260923T145705_7a6b9270/checkpoint_001320000",
      "checkpoint_file_count": 6,
      "checkpoint_hash": "150469de5cff9107f3f741365201113f1e8460d10505b2027fe1994025b22852",
      "checkpoint_path": "output_coevolution/revised/grid/ia2c/seed_101/domain_randomization/publication_20260923T145705_7a6b9270/checkpoint_001320000",
      "controller": "ia2c",
      "experiment_env_source_hash": "72773473a88abae5bf6fe048b953886fcde1c92481bc2010d368b3bd0b0a6517",
      "id": "continuation-grid-ia2c-domain_randomization",
      "kind": "continuation",
      "learning_steps": 2320000,
      "manifest_file_sha256": "40e2ff1fb5030c8e29c1e0c16ed66c9e64ffbf78e2397dafa855a256a59282c6",
      "manifest_hash": "cdb3df518e403eb9a323949d3c905a457ccb4a2fc95b3015d125494610b74809",
      "manifest_path": "output_coevolution/revised/grid/ia2c/seed_101/domain_randomization/publication_20260923T145705_7a6b9270/manifest.json",
      "method": "domain_randomization",
      "network": "grid",
      "result_path": "output_coevolution/revised/grid/ia2c/seed_101/domain_randomization/publication_20260923T145705_7a6b9270/result.json",
      "runtime": {
        "blas_threads": "1",
        "concurrent_workers": "unspecified",
        "logical_cpus": 20,
        "numpy": "1.19.5",
        "omp_threads": "1",
        "platform": "Linux-6.8.0-124-generic-x86_64-with-debian-bookworm-sid",
        "python": "3.6.13",
        "tensorflow": "1.12.0",
        "tensorflow_threads": 1
      },
      "runtime_compatibility": "reference_runtime_group",
      "source_commit": "8fd0e625b0535502fada77020e6db418939e2225",
      "stage_simulation_steps": 1320000,
      "status": "complete",
      "training_seed": 101
    },
    {
      "checkpoint_absolute_path": "/home/sdc_joran/Journal/deeprl_signal_control/output_coevolution/revised/grid/ia2c/seed_101/fixed_wce/publication_20260924T054007_773e599b/checkpoint_001320000",
      "checkpoint_file_count": 10,
      "checkpoint_hash": "ee6db062be779a8bf699d3c19b07fac53c3e81cc83c5bcee00d551b9d258c947",
      "checkpoint_path": "output_coevolution/revised/grid/ia2c/seed_101/fixed_wce/publication_20260924T054007_773e599b/checkpoint_001320000",
      "controller": "ia2c",
      "experiment_env_source_hash": "72773473a88abae5bf6fe048b953886fcde1c92481bc2010d368b3bd0b0a6517",
      "id": "continuation-grid-ia2c-fixed_wce",
      "kind": "continuation",
      "learning_steps": 2320000,
      "manifest_file_sha256": "27c5ba16acfede5316d6203ea2b9c932f3f413a879e9b95b58d9e0d8c38b0fb6",
      "manifest_hash": "eeeceaf9ea26d93b637107b98dce7b152fca8cd115daeb3aace6d0ee0a87a559",
      "manifest_path": "output_coevolution/revised/grid/ia2c/seed_101/fixed_wce/publication_20260924T054007_773e599b/manifest.json",
      "method": "fixed_wce",
      "network": "grid",
      "result_path": "output_coevolution/revised/grid/ia2c/seed_101/fixed_wce/publication_20260924T054007_773e599b/result.json",
      "runtime": {
        "blas_threads": "1",
        "concurrent_workers": "unspecified",
        "logical_cpus": 20,
        "numpy": "1.19.5",
        "omp_threads": "1",
        "platform": "Linux-6.8.0-124-generic-x86_64-with-debian-bookworm-sid",
        "python": "3.6.13",
        "tensorflow": "1.12.0",
        "tensorflow_threads": 1
      },
      "runtime_compatibility": "reference_runtime_group",
      "source_commit": "8fd0e625b0535502fada77020e6db418939e2225",
      "stage_simulation_steps": 1320000,
      "status": "complete",
      "training_seed": 101
    },
    {
      "checkpoint_absolute_path": "/home/sdc_joran/Journal/deeprl_signal_control/output_coevolution/revised/grid/ia2c/seed_101/online_wce/publication_20260925T092820_79e065be/checkpoint_001320000",
      "checkpoint_file_count": 10,
      "checkpoint_hash": "e9554e80f4b4ee438f7cab5ff9f9f3d9255a4e52596266d2e61be413d3123722",
      "checkpoint_path": "output_coevolution/revised/grid/ia2c/seed_101/online_wce/publication_20260925T092820_79e065be/checkpoint_001320000",
      "controller": "ia2c",
      "experiment_env_source_hash": "72773473a88abae5bf6fe048b953886fcde1c92481bc2010d368b3bd0b0a6517",
      "id": "continuation-grid-ia2c-online_wce",
      "kind": "continuation",
      "learning_steps": 2320000,
      "manifest_file_sha256": "0fceac1d76ee6854ff0cfd7c34e5391b037e30a1baadbb10f1b5a8fe010229cd",
      "manifest_hash": "c287f051c2194d39c13537af78ddd977584f0b3c155b001a4a5cb080f55265b7",
      "manifest_path": "output_coevolution/revised/grid/ia2c/seed_101/online_wce/publication_20260925T092820_79e065be/manifest.json",
      "method": "online_wce",
      "network": "grid",
      "result_path": "output_coevolution/revised/grid/ia2c/seed_101/online_wce/publication_20260925T092820_79e065be/result.json",
      "runtime": {
        "blas_threads": "1",
        "concurrent_workers": "unspecified",
        "logical_cpus": 20,
        "numpy": "1.19.5",
        "omp_threads": "1",
        "platform": "Linux-6.8.0-124-generic-x86_64-with-debian-bookworm-sid",
        "python": "3.6.13",
        "tensorflow": "1.12.0",
        "tensorflow_threads": 1
      },
      "runtime_compatibility": "reference_runtime_group",
      "source_commit": "8fd0e625b0535502fada77020e6db418939e2225",
      "stage_simulation_steps": 1320000,
      "status": "complete",
      "training_seed": 101
    },
    {
      "checkpoint_absolute_path": "/home/sdc_joran/Journal/deeprl_signal_control/runs/revised/grid/ma2c/seed_101/baseline/publication_20260919T110516_de174e9f/checkpoint_001320000",
      "checkpoint_file_count": 6,
      "checkpoint_hash": "d63b5d13b4ed7e011cf27abb3b7b52a4f6d22544d6454081df3619e0cf2263ac",
      "checkpoint_path": "runs/revised/grid/ma2c/seed_101/baseline/publication_20260919T110516_de174e9f/checkpoint_001320000",
      "controller": "ma2c",
      "experiment_env_source_hash": "f949d8c233bad1247f6f9b0ca786b335d2a84c6124963d3797586125a50b207b",
      "id": "continuation-grid-ma2c-baseline",
      "kind": "continuation",
      "learning_steps": 2320000,
      "manifest_file_sha256": "69c4a453e26ad0661dd099b1a15545ce5b97850b9a17de2aefbb4cb6ba063620",